{
  "$schema": "https://json-schema.org/draft/2020-12/schema",
  "$id": "https://github.com/Xopoko/poland/blob/main/schemas/action-boundary.schema.json",
  "title": "Poland action boundary registry",
  "type": "object",
  "additionalProperties": false,
  "required": ["schema_version", "default_boundary", "boundaries", "global_never"],
  "properties": {
    "schema_version": {"const": "1.0.0"},
    "default_boundary": {"$ref": "#/$defs/slug"},
    "boundaries": {
      "type": "array",
      "minItems": 1,
      "maxItems": 16,
      "items": {"$ref": "#/$defs/boundary"}
    },
    "global_never": {
      "type": "array",
      "minItems": 1,
      "maxItems": 128,
      "uniqueItems": true,
      "items": {
        "type": "string",
        "minLength": 1,
        "maxLength": 160,
        "pattern": "^[a-z0-9]+(?:[_-][a-z0-9]+)*$"
      }
    }
  },
  "$defs": {
    "slug": {
      "type": "string",
      "minLength": 1,
      "maxLength": 80,
      "pattern": "^[a-z0-9]+(?:-[a-z0-9]+)*$"
    },
    "automation": {
      "enum": [
        "public_read_only",
        "task_scoped_assistance",
        "confirmation_gated_external_effect",
        "user_only_restricted"
      ],
      "description": "Effect policy for the boundary. Confirmation-gated effects require a fresh visible summary; user-only actions cannot be delegated by confirmation."
    },
    "actionList": {
      "type": "array",
      "maxItems": 64,
      "uniqueItems": true,
      "items": {
        "type": "string",
        "minLength": 1,
        "maxLength": 120,
        "pattern": "^[a-z0-9]+(?:[_-][a-z0-9]+)*$"
      }
    },
    "boundary": {
      "type": "object",
      "additionalProperties": false,
      "required": ["id", "automation", "allowed", "requires_confirmation", "never"],
      "properties": {
        "id": {"$ref": "#/$defs/slug"},
        "automation": {"$ref": "#/$defs/automation"},
        "allowed": {
          "description": "Actions available once the boundary's prerequisites are satisfied.",
          "allOf": [
            {"$ref": "#/$defs/actionList"},
            {"minItems": 1}
          ]
        },
        "requires_confirmation": {
          "description": "Actions requiring explicit task-scope authorization or a fresh action-time confirmation as specified by the boundary.",
          "$ref": "#/$defs/actionList"
        },
        "never": {
          "description": "Actions that cannot be delegated within this boundary; confirmation does not unlock them.",
          "allOf": [
            {"$ref": "#/$defs/actionList"},
            {"minItems": 1}
          ]
        }
      }
    }
  }
}
